{
  "schema_version": "1.0.0",
  "type": "recipe",
  "id": "https://example.com/recipes/ai-cookie",
  "source_url": "https://example.com/recipes/ai-cookie",
  "title": "AI-Chip Cookies",
  "language": "en",
  "summary": "Crunchy, chocolatey cookies with a smart twist.",
  "tags": ["dessert"],
  "last_modified": "2025-08-24T12:45:00Z",
  "content_version": "1.0.0",
  "page_checksum": "checksumrecipe1234567890abcdefghijklmnopqrstuvwxyz==",
  "license": "CC-BY-4.0",
  "publisher": { "name": "Example Kitchen", "url": "https://example.com" },
  "content": {
    "prep_time_minutes": 15,
    "cook_time_minutes": 12,
    "total_time_minutes": 27,
    "yield": "24 cookies",
    "ingredients": ["2 cups flour", "1 cup sugar", "1 cup chocolate chips"],
    "steps": ["Preheat oven to 180C.", "Mix ingredients.", "Bake 12 minutes."],
    "nutrition": { "calories": 120 },
    "images": ["https://example.com/images/ai-cookie.jpg"]
  }
}

